{
  "messageId": "11111111-1111-4111-8111-111111111111",
  "taskId": "22222222-2222-4222-8222-222222222222",
  "taskType": "script.generate",
  "projectId": "33333333-3333-4333-8333-333333333333",
  "episodeId": "44444444-4444-4444-8444-444444444444",
  "attempt": 0,
  "traceId": "trace-ms1-script-001",
  "createdAt": "2026-07-12T12:00:00Z",
  "payload": {
    "sourceText": "失忆将军在雨夜发现敌军密信。",
    "projectConfig": {
      "projectType": "single_episode",
      "targetDurationSeconds": 60,
      "aspectRatio": "9:16",
      "style": "古风悬疑"
    },
    "sourceMaterialId": "55555555-5555-4555-8555-555555555555"
  }
}
